,0,1,2,3,4,5,6,7
0,Settlement Date,Security Name,Symbol/ CUSIP,Transaction Description,Quantity,Unit Price,Cost Basis of Close,Transaction Total
1,8/2,SPDR SER TR BARCLAYS CAP HIGH YIELD BD ETF,JNK,You bought,100,$37.179,,"-$3,717.90"
2,8/2,SPDR SER TR BARCLAYS CAP HIGH YIELD BD ETF,SBRA,You bought,100,37.179,,"-$3,717.90"
3,8/2,SABRA HEALTH CARE REIT INC COM USD0.01,SBRA,You bought,200,11.040,,"-2,208.00"
4,8/2,SPDR SER TR BARCLAYS CAP HIGH YIELD BD ETF,JNK,"You sold LT loss: $5,210.22 LT disallowed loss: $5,210.22",-200,36.882,,"7,376.40"
5,Total Trades,Pending Settlement,,,,,,"$1,450.50"
